keilmuan,abstrak
5,This research is developed a Household Information System based on website. Household information system created for Division of Customer's Data and Information System in PT. Pelabuhan Indonesia II (Persero) Tanjung Priok. This division handles issues related to the application network and multimedia. This information system is created to resolve issues related to submission procedures of damage-handling and submission procedure of new item so that users can be more efficient in the utilization of time effort and cost in performing the procedures. This information system is created using PHP programming language. The sequence of process performed is starting from entering data to be submitted the approval of stakeholders and printing data that have been approved. The result of Black Box testing on the system using Equivalence Partitioning method shows that the system is functioning well and accordance with user requirements.
5,Citizen data record can be shown satistically such as according to family number education religion gender occupation and age group. Tabulation system of demography data used by Karya Penggawa subdistrict is still in manual method such as recording amount of citizen data on Ms. Office Excel. Constraint of using this citizens data record are difficult to get accurate information about citizens data consume too much time to check the report of citizen data in other word tabulation of demography data still not optimal yet. By those constraint then the information system of demography of Karya Penggawa subdistrict is needed. The system is a web based system with the main function is to form tabulation of demography which is able to show statistic of citizens data according to gender education occupation religion and age group on graphics. In addition the system able to make quarterly report of demography by choosing one of report format Print PDF Excel to minimize human error and make the work of staff of Karya Penggawa subdistrict easier in processing of demography.
6,The System Search Engine Repository Software Desktop was created with the aim for facilitating the users to get the software to be installed or used by the user. For Windows operating systems and Macintosh the system can download and check the latest version of the software that is already available. The system created provides a freeware software for Windows and Macintosh operating systems. For Linux the system displays and generates sources.list of Debian. In this research the system made using Extreme Programming and using web extraction techniques to extract data from website www.filehippo.com.
7,Every educational institution of Vocational High School periodically carries out the admission of new students. With the existence of Decision Support System is expected to assist schools in selecting new students. There are various methods in constructing a DSS and one of them is the method of AHP. AHP is one of DSS method that can handle the multi criteria selection. By using the result of DSS with AHP method as sample data and find the biggest criteria factor in a selection. The result of this study indicates that AHP method can be implemented in information system of new students admission and it can help to make decisions in the placement of departments based on the ability of students and the selected department.
1,Nowadays the development of information technology is growing rapidly not even be stopped. Such as the communication problems which recently seemed there is no distance anymore everything feels close it is all because of technology. Along with the development of science and technology emerging technology development is a GPS (Global Positioning System). In this study researchers design and build android-based application to find out public transport route in Bandar Lampung called Balam Trans utilizing GIS technology in it. This application allows you to search route of the city transportation (Angkot) and Bus Rapid Transit (BRT) in the city of Bandar Lampung so users no longer have difficulty in finding public transport to get to their destination location especially for migrants in the city of Bandar Lampung. Additionally this application can display information about public transportation and BRT route so as to broaden the users knowledge. This application was developed using Dijkstra's Algorithm for finding the shortest route. The conclusion of this study is the application Balam Trans successfully constructed and useful for every user who has used this Balam Trans applications proved by questionnaire application testing achieves good.
5,Radio Streaming is use technology for sending an audio file simultaneously on multiple computers on a network by using a small data packets and generates output semi-real time. In the process of streaming a music file will sound when the computer starts receiving the music file data. Shoutcast DNAS is a freeware that is used for streaming radio technology. Shoutcast help the user to provide an Internet Radio Private servers using software that has been provided. Winamp is a multimedia player device created by Nullsoft. The trial results of this study are the Application Streaming Radio can help the user to display the program content of radio play and lay Radio Streaming and display e-mail addresses website streaming and also Encoder used affects the occurrence of delay the connection is unstable causing disconnection in automatic processor speed and also the speed of the internet connection affects the buffering of streaming player or players. 
6,Smartphone is a primary need for everyone in the modern era. Various features and advantages are offered by smartphone to those who use it. Smartphone is also widely used to help people to support their activities and to accomplish their work. Within the development of technology GIS (Geographic Information System) has come along to provide service of locating a position of something in particular or a place to go. It is also used to locate its user with the help of satellite signal.  GPS can provide precise and accurate information on the position speed direction and time. In this study the researcher designs and builds an Android- based search application called ATM Maps utilizing GPS technology. This application allows you to search the location of ATMs in the city of Bandar Lampung by the way by the  ATM and by the city of Bandar Lampung.  In turn users can avoid difficulty in finding the location of an ATM. This will be a great help particularly to those who do not reside in the city of Bandar Lampung. Furthermore the application also displays the transfer code of each bank so as to assist users in making easier cash transfer. The application is developed utilizing parsing technique of XML Pull Parser. It compares the data stored in folder of Assets Project and that in the server. The conclusion of this study reveals that the ATM Maps is successfully constructed and proven to be useful for its users. It is indicated by excellent rating and comments of satisfaction on the Play Store. In this application the data is stored in Project Assets folder in purpose of reaching easy and quick access. In the other hand data updating for the applications can also be processed easily.
5,Most of the system or results of application the final project and computer thesis of science students that is creating applications that can help the performance of the Department. However applications made have not been utilized properly only presented and stored in the library only. Besides container or a place to attach the application provided are difficult for users because there are settings for connecting to the ftp server. This study built an Application Management System (AMS) as one of the solutions that can be implemented to overcome these problems. AMS is a software used to organize the content. AMS facilitates the application that will be displayed as content on the main website. Implementation AMS of the content on the website using PHP programming language and MySQL database. The test results using Equivalence Partitioning (EP) shows that the AMS has been built to facilitate the user in posting applications. Applications that are embedded into websites using AMS can be run properly.
5,The excess of plugin is more practical because it does not need to create a web from the base and web with attached plugin becomes better. Furthermore small in storage capacity. Plugin of seminar which has built has advantages from the system that already exist conventional system is still using whiteboards and paper plugin is successfully implemented into the web of Computer Science Department and dissemination of information about seminar schedule become more optimal as well this plugin has facility of reminder for lectures and college student that related to the seminar
5,Information on goegrapichal condition needed by stakeholders such as distance information location required information and other information. Geographic information system (GIS) which known sistem informasi geografis (SIG) is one of solution to aquire that geographic information. Tourism in Kabupaten Pesisir Barat is the object which become material of this research thesis. The reason is Kabupaten Pesisir Barat has good potency in tourism which present tourism destinations not only for domestic tourist but also international tourist. The tourism destination divided into marine tourism (wisata marina) water tourism (wisata tirta) historical tourism (wisata sejarah) and natural conservation tourism (wisata suaka alam). SIG web basis is made by using PHP programing and getting data on google maps using waterfall method and supporting software such us GPS coordinates and Xampp server.
1,Information can be kept secure by an encryption process in cryptography technique. In this research we discussed comparative analysis of symmetric algorithms: Tiny Encryption Algorithm (TEA) and LOKI in terms of their complexity time and speed performances. The testing was conducted using 30 data with size varies between 50 bytes and 1500 bytes. Thirty data were tested 50 times. The result shows that TEA is faster in encryption and decryption compared to LOKI  and the complexity of both algorithms are linear algorithms (O (n)).
5,The development of educational game is motivated by low interest and desire of people to learn Aksara Lampung therefore in this case is required a learning system which is attractive and pleasant so it can attract people to keep follow the development of existing technologies one of which is a learning system by using media of educational game. This research used eXtreme Programming (EX) method and was designed by using Unified Modeling Language (UML). This application tested by using Black Box Testing method with the approach of Equivalence Partitioning (EP) and the calculation of Likert Scale. On the other side based on the results obtained from the questionnaire this application is user friendly application (with an average value of 77% / Excellent).
1,Meet the patient's expectation is one of the requirements in health care quality. In order to achieve the healthcare quality hospitals need to change the paradigm from drug oriented to patient orientation. The main problem in health care quality today is patients waiting a long time for service and it will increase the morbidity risk and socioeconomic cost. A solution to resolve long service time is to implement a queuing system that can predict the actual queue situation. This study aim is estimating the  waiting time of patients using Network Queue Jackson Method. We build a queuing model with 8 single servers and consists of 4 health care facilities a registration 5 consultation points for the patient a pharmaceutical and a cashier. In this method uses rules First Come First Serve where consumers can move from one workstation to another workstation before leaving the system. Through the Network Queue Jackson each server or node can provide independent services that it possible to analyze each node separately
7,Fish disease is undesirable for fish farmers because it can cause low productivity and high mortality aquaculture. Lack of information on disease prevention methods small number of experts causing many farmers suffered losses. Therefore an expert system is needed to help diagnose the disease in fish. This system aims to help cultivators on resolve fish disease problem. In this research expert system based on android was built using Java program language as database Forward chaining was used. This method used to determine which roles will be executed then that rule is executed the process was repeated until we got the result. This system can diagnose 35 diseases from 8 species of fish. The data testing result used Equivalence Partitioning showed that management rules system can run based on its function and system can diagnose the disease well. On the other based on questionnaire data this application is an user friendly application (with average value of / excellent).
11,Libraries are part of the learning resources that should be owned by every school or college. Because learners easily find the information or knowledge through library. With the development of technology make people think to be able to work more effectively and efficiently. One of them is to make the conventional system to a computerized system. The website by utilizing the facilities connected to the internet. libraries can be more effective and efficient in searching and ordering books. In this research I have designed a web-based information systems using programming languages PHP MySQL. With this system is expected to address the various needs of the user to search for books and book as well as facilitate the administration of the school in the circulation of borrowing books and preparing reports. From the research that has been conducted on these results the authors implement in Designing Library Information System Web-Based on SMA Negeri 1 Penengahan.
7,School is an institution that was specifically designed for teaching students under the supervision of teachers. School that basically as a tool to implement education is expected to make more advanced society. This system is aimed as an alternative media to facilitate students and people who want to get information about senior and vocational high schools located in Bandar Lampung. In this study mapping the achievement of senior / vocational high school in Bandar Lampung was built based on android and by using Java programming language. Method used in this application is Waterfall and designed by using Unified Modeling Language (UML). This application includes 127 schools in Bandar Lampung consisting of 64 senior high schools (SMA) and 63 vocational high schools (SMK). This application has a variety of data such as school achievements the value of National Examination school address school pictures coordinates point of school and telephone number that can assist users to find information and location of High School and Vocational School in Bandar Lampung. Result of the test that performed by using Equivalence Partitioning method indicates that management rules of system can run properly as its function and this system can provide information properly. Additionally based on testing data this application is included into the category of user friendly application with the average value of percentage of 84.11% (Very Good).
11,Nowadays the internet is growing rapidly including in Indonesia. Internet has become an essential requirement for everyone to get information or other purposes. The benefits of internet make  many people use the internet as appliances for supporting their activities. The use of internet has an impact on the increasing demand to the internet services provider. Internet provider is a company which engaged in providing internet services. In the process of instalation and troubleshooting for internet network the provider requires a management information system which is used to organize the division of task for handling the installation and troubleshooting of internet network. The internet provider who has not had a management system yet will get difficulties to devide the tasks of their employees for handling the process of installation and troubleshooting of the internet network. This research created a management information system for installation and troubleshooting of internet network service which is recieve the information of internet interference from the customers and help in handling process division of tasks for installing and troubleshooting of internet network. This management information system was created using PHP (Hypertext Prepocessor) and some plugins such as twitter bootstrap and high chart. The result of Black Box testing showed that this management information system for installation and troubleshooting of internet network service has been successfully created as the users need.
5,Geographic Information Systems (GIS) is an information system which is used to input process and generate geographically or geospatial referenced data to support the decision making in a planning. This technology can be used on an Android-based smartphone. Internet accelerometer digital maps and GPS (Global Positioning System) on Android can be integrated so that GIS can be implemented. In this study GIS technology is implemented to detect and find the location of health care providers in city of Bandar Lampung. This application is designed and implemented by using Java programming language and Google Maps API to show the location of health care providers. Testing phase by using Equivalence Partitioning method indicates that the function of the application has been running in accordance with the analysis.
5,Comic is a general term used to denote the phenomenon of images that is put together in sequence and placed side by side.  It is usually available in the form of physical book but in order to follow the development of digital technology digital comic was born.  Comic Reader is an application that is created to digitally distribute and read comics.  This application uses Yii as the framework.  Yii is a PHP based framework that uses the MVC architectural pattern.
5,Technology developments have a positive impact in delivery of news or information to the public to be more easily and quickly without any distance limitation in access news. This is supported by the development of internet access which increase rapidly so that everyone in the world can access or share information in real time (without any lag time). News Portal Of Daily Lampung Newspaper Based On Android is an application that provides convenience to the public in obtaining information or news. News Portal Based On Android provide news which taken from website lampungnewspaper.citm.co.id. Things become a study in this thesis is connecting between Android platform with website database platform using library Volley. News Portal is made using Android Studio and retrieve data from database website lampungnewspaper.citm.co.id with Waterfall method.
5,Bird is one of animals that can be found di various habitats its existence spread from the forest the plantation until the urban. Bird is also one group of animals that close to human life. The aim of this system is to be an alternative media to facilitate people who want to get information about the types of birds in Lampung University. In this research android- based field guide to the types of birds of  Lampung University area is using java programming language. The method which is used in this application is Waterfall and Unified Modeling Language (UML) design. This application contains 61 types of birds that can be found in Lampung University. The data of this application are pictures of birds name of birds Latin name English name family name description and status that can help the user to recognize the types of birds which they find in Lampung University. The data result used Equivalence Partitioningtesting showed that the rules of the system can work suitable with the function and the system can give information well. This application is a category of variable user friendly with average (very well) and a category of interactive variable with average (very well).
7,Rice plant diseases can be identified from their symptoms. To find out exactly the rice plant disease it will need agricultural experts. Numbers and distributions of agricultural expert are very limited and they cannot overcome the problems optimally so that a system containing knowledge as what experts do is required. This research was to design web-based experts system by using forward chaining method and certainty factor. Data processed in this system were 16 diseases and 26 of disease symptoms. This system which was developed had superiorities and easiness in accessing it user friendly and displaying certainty levels from diagnosis results with 81% of customer's satisfaction.
7,Distance students can be seen from the data stored student's address. Address high school students in the Pringsewu District have different distances. This research was conducted to determine the classification of the distance stored in high school students in the Pringsewu District. Distance students are classified to obtain five categories: 'sangat dekat' 'dekat' 'sedang' 'cukup jauh' and 'jauh' by using eight attributes are 'nomor' 'SMA' 'kabupaten' 'kecamatan' 'kelurahan' 'jarak' 'asal SMP' and 'class'. The classification performed by using Naive Bayes using Weka tool. Distribution of training data and testing data is different as much as 20 times of testing resulting in the highest accuracy Naive Bayes is 89.329% on distribution of 60% training data : 40% testing data. The data of students address and information classification results displayed in the form of digital map that is mapping of student's address in high school in the Pringsewu District.
6,Data Bank System is a place that is used to store data. In Computer Science Department Data Bank System that is used to store data of students score at Computer Science Department. The System of Students Data Bank Score at Computer Science Department is still in manual form. Therefore the system of Students Data Bank score at Computer Science Department that is still in the manual system is developed to be digital system. In searching the system of students data bank Score at Computer Science Department in digital form by applying Brute Force algorithm. Brute Force algorithm is a string searching algoritm which is used each character checking method in pattern with every character in the text. Data searching in the System of Students Data Bank Score at Computer Science Department the testing was done with some case  tests that focused on functional system. Data searching in the System of Students Data Bank Score at Computer Science Department was using Brute Force Method by ten people that was randomly chosen. The questionnaire result of system testing was using Likert scale with the result of final score was or it could be stated that the System of Students Data Bank Score at Computer Science Department by using Brute Force method was Very Good.
7,Local Government Finance and Regional Asset Lampung Tengah Regency is a government agency that is engaged in the field of financial management and regional assets. Employees are resources that very important to determining the success of a work unit. Efforts to improve the quality of the performance of a public servant namely the position increase. Incumbency is the position that indicates the level of a Civil Servants. Incumbency increase is an award given on work performance and dedication Civil Servants. Decision Support System which can help facilitate determining an employee can be said to be worthy for incumbency increase. In this study the calculation method of decision making used is Simple Additive Weighting (SAW) with 6 criteria echelon working lives of civil servent working lives of echelon working lives of incumbency last education and training. The system is built using the PHP programming language. The test results using Black Box Testing and questionnaires show that the system can be function according to user needs and system is deemed to have the criteria of incumbency increase structural of the Civil Servant in Local Government Finance and Regional Asset Lampung Tengah Regency.
4,This early (nowadays) Internet Service Provider has been growing rapidly. To choose Internet Service Provider is extremely difficult because every Internet Service Provider has its advantages and disadvantages as well. Some methods such as Failover Per Connection Classifier Round Robin and several others are able to combine between an internet connection from several multiple Internet Service Provider. Failover method is being useful for separating between the Internet Service Provider that will be a priority connection and the backup connection. In this application two or more Internet Service Providers cooperate together to keep the Internet connection remain stable. By using the application it is no longer difficult to handle the problem of bad Internet Service Provider.
